{
  "id": 1354,
  "is_variant_pet": false,
  "is_dark_pet": false,
  "is_shine_pet": false,
  "is_rare_pet": false,
  "is_breeding_pet": false,
  "is_fusion_pet": false,
  "evolution_chain": [
    {
      "id": 2657,
      "url": "https://api.seerapi.com/v1/pet/2657/"
    }
  ],
  "hash": "8c9b1002"
}